[
  {
    "id": "fx_01_original_source_correction",
    "case": "original_source_correction",
    "description": "The original source corrects a previously accepted value.",
    "events": [
      {
        "id": "evt_01_01",
        "type": "snapshot_created",
        "actor": "m0_fixture",
        "transaction_time": "2026-01-01T00:00:00Z",
        "generation": 1,
        "payload": {
          "snapshot": {
            "id": "snp_correction",
            "url": "https://example.test/correction",
            "content_hash": "aaaaaaaaaaaaaaaaaaaaaaaaaaaaaaaaaaaaaaaaaaaaaaaaaaaaaaaaaaaaaaaa",
            "availability": "available"
          }
        }
      },
      {
        "id": "evt_01_02",
        "type": "claim_accepted",
        "actor": "m0_fixture",
        "transaction_time": "2026-01-02T00:00:00Z",
        "generation": 2,
        "payload": {
          "claim": {
            "id": "clm_original_value",
            "label": "original_value",
            "statement": {
              "subject": "subject",
              "predicate": "has_value",
              "object": "old"
            },
            "scope": "global",
            "kind": "fact",
            "evidence": [
              {
                "snapshot_id": "snp_correction",
                "snapshot_hash": "aaaaaaaaaaaaaaaaaaaaaaaaaaaaaaaaaaaaaaaaaaaaaaaaaaaaaaaaaaaaaaaa",
                "span": {
                  "kind": "character",
                  "start": 0,
                  "end": 10
                },
                "stance": "supports"
              }
            ]
          }
        },
        "base_generation": 1
      },
      {
        "id": "evt_01_03",
        "type": "claim_superseded",
        "actor": "m0_fixture",
        "transaction_time": "2026-01-03T00:00:00Z",
        "generation": 3,
        "payload": {
          "prior_claim_id": "clm_original_value",
          "claim": {
            "id": "clm_corrected_value",
            "label": "corrected_value",
            "statement": {
              "subject": "subject",
              "predicate": "has_value",
              "object": "new"
            },
            "scope": "global",
            "kind": "fact",
            "evidence": [
              {
                "snapshot_id": "snp_correction",
                "snapshot_hash": "aaaaaaaaaaaaaaaaaaaaaaaaaaaaaaaaaaaaaaaaaaaaaaaaaaaaaaaaaaaaaaaa",
                "span": {
                  "kind": "character",
                  "start": 0,
                  "end": 10
                },
                "stance": "supports"
              }
            ]
          }
        },
        "base_generation": 2
      }
    ],
    "expected": {
      "projection": {
        "generation": 3,
        "accepted": {
          "clm_corrected_value": {
            "id": "clm_corrected_value",
            "label": "corrected_value",
            "statement": {
              "subject": "subject",
              "predicate": "has_value",
              "object": "new"
            },
            "scope": "global",
            "kind": "fact",
            "evidence": [
              {
                "snapshot_id": "snp_correction",
                "snapshot_hash": "aaaaaaaaaaaaaaaaaaaaaaaaaaaaaaaaaaaaaaaaaaaaaaaaaaaaaaaaaaaaaaaa",
                "span": {
                  "kind": "character",
                  "start": 0,
                  "end": 10
                },
                "stance": "supports"
              }
            ],
            "state": "accepted",
            "last_generation": 3
          }
        },
        "history": {
          "clm_original_value": {
            "id": "clm_original_value",
            "label": "original_value",
            "statement": {
              "subject": "subject",
              "predicate": "has_value",
              "object": "old"
            },
            "scope": "global",
            "kind": "fact",
            "evidence": [
              {
                "snapshot_id": "snp_correction",
                "snapshot_hash": "aaaaaaaaaaaaaaaaaaaaaaaaaaaaaaaaaaaaaaaaaaaaaaaaaaaaaaaaaaaaaaaa",
                "span": {
                  "kind": "character",
                  "start": 0,
                  "end": 10
                },
                "stance": "supports"
              }
            ],
            "state": "superseded",
            "last_generation": 3
          },
          "clm_corrected_value": {
            "id": "clm_corrected_value",
            "label": "corrected_value",
            "statement": {
              "subject": "subject",
              "predicate": "has_value",
              "object": "new"
            },
            "scope": "global",
            "kind": "fact",
            "evidence": [
              {
                "snapshot_id": "snp_correction",
                "snapshot_hash": "aaaaaaaaaaaaaaaaaaaaaaaaaaaaaaaaaaaaaaaaaaaaaaaaaaaaaaaaaaaaaaaa",
                "span": {
                  "kind": "character",
                  "start": 0,
                  "end": 10
                },
                "stance": "supports"
              }
            ],
            "state": "accepted",
            "last_generation": 3
          }
        },
        "conflicts": {},
        "snapshots": {
          "snp_correction": {
            "id": "snp_correction",
            "url": "https://example.test/correction",
            "content_hash": "aaaaaaaaaaaaaaaaaaaaaaaaaaaaaaaaaaaaaaaaaaaaaaaaaaaaaaaaaaaaaaaa",
            "availability": "available"
          }
        },
        "quarantine": {},
        "rejected_patches": []
      },
      "canonical_hash": "d6c62e3365cc27225ad3c49744a4bc43f2db9f1d9ae1aa3eb6e34c580679b93a",
      "human_diff": "original_value -> corrected_value"
    },
    "forbidden_outcomes": [
      "delete original history",
      "return original as current"
    ]
  },
  {
    "id": "fx_02_independent_source_conflict",
    "case": "independent_source_conflict",
    "description": "Two independent sources directly conflict.",
    "events": [
      {
        "id": "evt_02_01",
        "type": "snapshot_created",
        "actor": "m0_fixture",
        "transaction_time": "2026-01-01T00:00:00Z",
        "generation": 1,
        "payload": {
          "snapshot": {
            "id": "snp_conflict_a",
            "url": "https://example.test/conflict_a",
            "content_hash": "bbbbbbbbbbbbbbbbbbbbbbbbbbbbbbbbbbbbbbbbbbbbbbbbbbbbbbbbbbbbbbbb",
            "availability": "available"
          }
        }
      },
      {
        "id": "evt_02_02",
        "type": "snapshot_created",
        "actor": "m0_fixture",
        "transaction_time": "2026-01-02T00:00:00Z",
        "generation": 2,
        "payload": {
          "snapshot": {
            "id": "snp_conflict_b",
            "url": "https://example.test/conflict_b",
            "content_hash": "cccccccccccccccccccccccccccccccccccccccccccccccccccccccccccccccc",
            "availability": "available"
          }
        },
        "base_generation": 1
      },
      {
        "id": "evt_02_03",
        "type": "claim_accepted",
        "actor": "m0_fixture",
        "transaction_time": "2026-01-03T00:00:00Z",
        "generation": 3,
        "payload": {
          "claim": {
            "id": "clm_answer_a",
            "label": "answer_a",
            "statement": {
              "subject": "subject",
              "predicate": "has_value",
              "object": "A"
            },
            "scope": "global",
            "kind": "fact",
            "evidence": [
              {
                "snapshot_id": "snp_conflict_a",
                "snapshot_hash": "bbbbbbbbbbbbbbbbbbbbbbbbbbbbbbbbbbbbbbbbbbbbbbbbbbbbbbbbbbbbbbbb",
                "span": {
                  "kind": "character",
                  "start": 0,
                  "end": 10
                },
                "stance": "supports"
              }
            ]
          }
        },
        "base_generation": 2
      },
      {
        "id": "evt_02_04",
        "type": "claim_disputed",
        "actor": "m0_fixture",
        "transaction_time": "2026-01-04T00:00:00Z",
        "generation": 4,
        "payload": {
          "conflict_id": "cnf_answer_a_vs_answer_b",
          "claims": [
            {
              "id": "clm_answer_a",
              "label": "answer_a",
              "statement": {
                "subject": "subject",
                "predicate": "has_value",
                "object": "A"
              },
              "scope": "global",
              "kind": "fact",
              "evidence": [
                {
                  "snapshot_id": "snp_conflict_a",
                  "snapshot_hash": "bbbbbbbbbbbbbbbbbbbbbbbbbbbbbbbbbbbbbbbbbbbbbbbbbbbbbbbbbbbbbbbb",
                  "span": {
                    "kind": "character",
                    "start": 0,
                    "end": 10
                  },
                  "stance": "supports"
                }
              ]
            },
            {
              "id": "clm_answer_b",
              "label": "answer_b",
              "statement": {
                "subject": "subject",
                "predicate": "has_value",
                "object": "B"
              },
              "scope": "global",
              "kind": "fact",
              "evidence": [
                {
                  "snapshot_id": "snp_conflict_b",
                  "snapshot_hash": "cccccccccccccccccccccccccccccccccccccccccccccccccccccccccccccccc",
                  "span": {
                    "kind": "character",
                    "start": 0,
                    "end": 10
                  },
                  "stance": "opposes"
                }
              ]
            }
          ]
        },
        "base_generation": 3
      }
    ],
    "expected": {
      "projection": {
        "generation": 4,
        "accepted": {},
        "history": {
          "clm_answer_a": {
            "id": "clm_answer_a",